{"apiVersion":"kernel-zero.dev/custody/v1","approvalId":"0195f000-0000-7000-8000-000000000012","approvedAt":"2026-01-15T12:00:00.000Z","approverId":"0195f000-0000-7000-8000-000000000011","authorId":"0195f000-0000-7000-8000-000000000010","integrity":{"algorithm":"sha256","digest":"sha256:3333333333333333333333333333333333333333333333333333333333333333"},"kind":"PolicyApproval","policy":{"digest":"sha256:1111111111111111111111111111111111111111111111111111111111111111","kind":"RepositoryPolicy","name":"service-boundaries","revision":1},"signature":{"algorithm":"ed25519","keyId":"workspace-authority-1","value":"AAAAAAAAAAAAAAAAAAAAAAAAAAAAAAAAAAAAAAAAAAAAAAAAAAAAAAAAAAAAAAAAAAAAAAAAAAAAAAAAAAAAAA=="},"workspace":"0195f000-0000-7000-8000-000000000002"}
